paper_id,tag,directory,title,algorithm_name,algorithm_full_name,target_journal,backup_journal,main_experiments,ablations,baseline_methods
mintou_p1,mintou,mintou_p1_dstar_gru_dispatch,Digital-Twin Siamese GRU for Similarity-Aware Multi-Objective Power Grid Dispatch under Load and Topology Uncertainty,DSTAR-GRU,Digital-twin Siamese Temporal Alignment and Retrieval GRU,IEEE Access,Electronics,7,6,8
mintou_p2,mintou,mintou_p2_hygraph_load_forecasting,Hyperbolic Graph Neural Forecasting for Hierarchical Power Load Prediction in Smart Dispatch Systems,HyG-LoadFormer,Hyperbolic Graph Load Forecasting Transformer,Electronics,Applied Sciences,8,7,9
mintou_p3,mintou,mintou_p3_samode_distribution_planning,Self-Adaptive Multi-Objective Differential Evolution for Reproducible Distribution Network Planning with DER and Storage Integration,CARS-MODE,Constraint-Aware Repair and Strategy-adaptive Multi-Objective Differential Evolution,Energies,Applied Sciences,7,8,6
mintou_p4,mintou,mintou_p4_shield_resilience_planning,Scenario-Aware Hybrid Multi-Objective Evolution for Resilient Distribution Network Planning under DER and Load Uncertainty,SHIELD-MOEA,Scenario-screened Hybrid Evolution for Load-serving Distribution Resilience,Energies,IEEE Access,8,7,5
mintou_p5,mintou,mintou_p5_trace_moea_feasibility_review,Hybrid Multi-Objective Evolution for Traceable Power Grid Feasibility Review and Investment Effectiveness Optimization,TRACE-MOEA,Traceable Review-Aware Coevolutionary Multi-Objective Evolution,IEEE Access,Energies,7,8,6
mintou_p6,mintou,mintou_p6_bilonsga_project_review,Non-Dominated Sorting with Bidirectional Local Search for Budget-Constrained Power Grid Project Review,BiLo-NSGA,Bidirectional Local-search Non-dominated Sorting Genetic Algorithm,Applied Sciences,IEEE Access,8,9,6
